{
  "protocol": "baijin-chatgpt-review-result/1.0",
  "result_id": "chatgpt-review-result-changes-001",
  "invocation_id": "invocation-mcp-002",
  "repository": "shunhang776/xinbaijin-mcp",
  "branch": "dev",
  "status": "review_submitted",
  "reviewed_commit": "2222222222222222222222222222222222222222",
  "based_on_branch_head": "2222222222222222222222222222222222222222",
  "review_commit": "cccccccccccccccccccccccccccccccccccccccc",
  "verdict": "changes_requested",
  "findings": [
    {
      "severity": "medium",
      "file": "worker.js",
      "line": 12,
      "title": "Sample finding",
      "description": "Sample review finding for contract validation.",
      "recommendation": "Fix the affected logic before continuing the L4 loop."
    }
  ],
  "readback": {
    "verified": true,
    "reviewed_commit_matches": true,
    "based_on_branch_head_matches": true,
    "verdict_matches": true,
    "findings_match": true,
    "utf8_valid": true,
    "sha256": "dddddddddddddddddddddddddddddddddddddddddddddddddddddddddddddddd",
    "byte_length": 1024,
    "line_ending": "LF",
    "final_newline": true
  },
  "created_at": "2026-06-27T00:00:00.000Z"
}
